{
  "_sample_comment": "这是一个 sample，文件实质完成后删掉这行注释",
  "work_item_id": "2026-001-sample-article",
  "review_status": "passed",
  "persona_consistency": 0.8,
  "source_trait_fidelity": 0.6,
  "source_leakage": 0.0,
  "originality": 1.0,
  "cross_persona_distinction": 0.8,
  "findings": ["Sample-only review result; no publication approval implied."]
}
